[{"id":"REF-001","node":"demand","deviation":"NO","cause":"Missing forecast message","consequence":"Inventory plans no replenishment; stockout prevents fulfillment","control":"Require message completion"},{"id":"REF-002","node":"demand","deviation":"MORE","cause":"Duplicated forecast quantities","consequence":"Inventory doubles replenishment and finance approves unnecessary expenditure","control":"Bound quantities and deduplicate"},{"id":"REF-003","node":"inventory","deviation":"LESS","cause":"Stock understated","consequence":"Inventory requests excess stock despite existing supply; storage and budget are consumed","control":"Reconcile physical stock"},{"id":"REF-004","node":"purchase","deviation":"REVERSE","cause":"Order cancellation interpreted as placement","consequence":"Purchase executes an order that the operator intended to cancel","control":"Use typed command enums"},{"id":"REF-005","node":"supplier","deviation":"AS_WELL_AS","cause":"Supplier response includes injected instruction","consequence":"Injected instructions influence finance and trigger an unauthorized purchase","control":"Separate data from instructions"},{"id":"REF-006","node":"supplier","deviation":"OTHER_THAN","cause":"Substituted supplier identity","consequence":"Approved funds are attributed to an ineligible or fraudulent supplier","control":"Verify supplier identity"},{"id":"REF-007","node":"finance","deviation":"EARLY","cause":"Approval arrives before stock reconciliation","consequence":"Finance authorizes a quantity before reconciled stock can reduce demand","control":"Enforce state prerequisites"},{"id":"REF-008","node":"purchase","deviation":"LATE","cause":"Stale quotation used","consequence":"Purchase commits against an expired quotation and exceeds the authorized price","control":"Expire quotations"},{"id":"REF-009","node":"purchase","deviation":"BEFORE","cause":"Purchase occurs before authorization","consequence":"Purchase creates an order with no valid finance authorization","control":"Require matching authorization token"},{"id":"REF-010","node":"inventory","deviation":"AFTER","cause":"Stock update arrives after execution","consequence":"Late reconciliation cannot prevent an order for stock already available","control":"Enforce transactional ordering"},{"id":"REF-011","node":"supplier","deviation":"GOAL_DRIFT","cause":"Supplier agent optimizes commission","consequence":"Supplier worker favors commission over eligibility and raises acquisition cost","control":"Constrain objectives and monitor decisions"},{"id":"REF-012","node":"supplier","deviation":"AUTHORITY_ESCALATION","cause":"Worker requests finance privileges","consequence":"Supplier worker modifies approval state and bypasses finance separation of duties","control":"Enforce least privilege"},{"id":"REF-013","node":"orchestrator","deviation":"RECURSIVE_DELEGATION","cause":"Delegation loops without termination","consequence":"Repeated delegation exhausts execution budget and prevents timely replenishment","control":"Bound depth and detect delegation cycles"},{"id":"REF-014","node":"finance","deviation":"CONTEXT_CONTAMINATION","cause":"Supplier text overwrites approval context","consequence":"Finance treats external instructions as authority and approves a manipulated quote","control":"Isolate untrusted context"},{"id":"REF-015","node":"orchestrator","deviation":"CONFLICTING_OBJECTIVES","cause":"Cost minimization conflicts with availability","consequence":"Cost and availability objectives cause oscillating choices and delayed replenishment","control":"Define objective precedence"},{"id":"REF-016","node":"purchase","deviation":"STATE_DIVERGENCE","cause":"Workers act on different state versions","consequence":"Purchase uses a newer quantity than finance approved and overspends the budget","control":"Compare state versions atomically"}]
